,"I. SKUPAJ PRIHODKI (70+71+72+73+74+78)","8409304714"
,"TEKOČI PRIHODKI (70+71)","7392163858"
"70","DAVČNI PRIHODKI","6891769661"
"700","Davki na dohodek in dobiček","1392141760"
"7000","Dohodnina","897023342"
"7001","Davek od dohodkov pravnih oseb","488460000"
"7002","Drugi davki na dohodek in dobiček","6658417"
"701","Prispevki za socialno varnost","53467798"
"7010","Prispevki zaposlenih","29113479"
"7011","Prispevki delodajalcev","19816131"
"7012","Prispevki samozaposlenih","2907794"
"7013","Ostali prispevki za socialno varnost","1630394"
"702","Davki na plačilno listo in delovno silo","27563172"
"7021","Posebni davek na določene prejemke","27563172"
"703","Davki na premoženje","39763320"
"7033","Davki na promet nepremičnin in na finančno premoženje","39763320"
"704","Domači davki na blago in storitve","5239487776"
"7040","Davek na dodano vrednost","3062525429"
"7041","Drugi davki na blago in storitve","110194770"
"7042","Trošarine (akcize)","1656513899"
"7044","Davki na posebne storitve","162182368"
"7046","Letna dajatev za uporabo vozil v cestnem prometu","131232826"
"7047","Drugi davki na uporabo blaga in storitev","72733124"
"7048","Davki od prometa motornih vozil","44105361"
"705","Davki na mednarodno trgovino in transakcije","89345834"
"7050","Carine","89345834"
"706","Drugi davki","50000000"
"7060","Drugi davki","50000000"
"71","NEDAVČNI PRIHODKI","500394196"
"710","Udeležba na dobičku in dohodki od premoženja","207226229"
"7100","Prihodki od udeležbe na dobičku in dividend ter presežkov prihodkov nad odhodki","100110960"
"7102","Prihodki od obresti","26500000"
"7103","Prihodki od premoženja","80615269"
"711","Takse in pristojbine","95693574"
"7110","Sodne takse","58723568"
"7111","Upravne takse in pristojbine","36970006"
"712","Globe in druge denarne kazni","70955556"
"7120","Globe in druge denarne kazni","70955556"
"713","Prihodki od prodaje blaga in storitev","9750933"
"7130","Prihodki od prodaje blaga in storitev","9750933"
"714","Drugi nedavčni prihodki","116767904"
"7141","Drugi nedavčni prihodki","116767904"
"72","KAPITALSKI PRIHODKI","17592595"
"720","Prihodki od prodaje osnovnih sredstev","16968129"
"7200","Prihodki od prodaje zgradb in prostorov","16277482"
"7201","Prihodki od prodaje prevoznih sredstev","375956"
"7202","Prihodki od prodaje opreme","302528"
"7203","Prihodki od prodaje drugih osnovnih sredstev","12163"
"721","Prihodki od prodaje zalog","2307"
"7211","Prihodki od prodaje drugih zalog","2307"
"722","Prihodki od prodaje zemljišč in neopredmetenih sredstev","622159"
"7220","Prihodki od prodaje kmetijskih zemljišč in gozdov","340175"
"7221","Prihodki od prodaje stavbnih zemljišč","281984"
"73","PREJETE DONACIJE","8076301"
"730","Prejete donacije iz domačih virov","75756"
"7300","Prejete donacije in darila od domačih pravnih oseb","56220"
"7301","Prejete donacije in darila od domačih fizičnih oseb","19536"
"731","Prejete donacije iz tujine","8000545"
"7310","Prejete donacije in darila od tujih nevladnih organizacij in fundacij","1857668"
"7311","Prejete donacije in darila od tujih vlad in vladnih institucij","6142877"
"74","TRANSFERNI PRIHODKI","1143133"
"740","Transferni prihodki iz drugih javnofinančnih institucij","1143133"
"7400","Prejeta sredstva iz državnega proračuna","1119462"
"7402","Prejeta sredstva iz skladov socialnega zavarovanja","23671"
"78","PREJETA SREDSTVA IZ EVROPSKE UNIJE","990328828"
"781","Prejeta sredstva iz proračuna EU za izvajanje skupne kmetijske in ribiške politike","265781884"
"7810","Prejeta sredstva iz proračuna EU iz naslova tržnih ukrepov v kmetijstvu iz Evropskega kmetijskega jamstvenega in usmerjevalnega sklada - Jamstveni del (EAGGF - Guarantee Fund) in Evropskega kmetijskega jamstvenega sklada (EKJS)","5645500"
"7811","Prejeta sredstva iz proračuna EU iz naslova neposrednih plačil v kmetijstvu iz Evropskega kmetijskega jamstvenega in usmerjevalnega sklada - Jamstveni del (EAGGF - Guarantee Fund) in Evropskega kmetijskega jamstvenega sklada (EKJS)","143273000"
"7812","Prejeta sredstva iz proračuna EU iz naslova programa razvoja podeželja iz Evropskega kmetijskega jamstvenega in usmerjevalnega sklada - Jamstveni del (EAGGF - Guarantee Fund) in Evropskega kmetijskega sklada za razvoj podeželja (EKSRP)","109801134"
"7813","Ostala prejeta sredstva iz proračuna EU za izvajanje skupne kmetijske politike","2362250"
"7814","Prejeta sredstva iz proračuna EU za izvajanje skupne ribiške politike","4700000"
"782","Prejeta sredstva iz proračuna EU iz strukturnih skladov","362944042"
"7821","Prejeta sredstva iz proračuna EU iz Evropskega sklada za regionalni razvoj (ERDF)","255578337"
"7822","Prejeta sredstva iz Evropskega socialnega sklada (ESF)","107365705"
"783","Prejeta sredstva iz proračuna EU iz kohezijskega sklada","336452902"
"7830","Prejeta sredstva iz Kohezijskega sklada (CF)","336452902"
"784","Prejeta sredstva iz proračuna EU za izvajanje centraliziranih in drugih programov EU","21800000"
"7841","Druga prejeta sredstva iz proračuna EU za izvajanje notranjih politik EU 2004 - 2006","13000000"
"7843","Prejeta sredstva iz proračuna EU iz naslova Državljanstvo, svoboda, varnost in pravica","8800000"
"786","Ostala prejeta sredstva iz proračuna Evropske unije","3350000"
"7860","Ostala prejeta sredstva iz proračuna EU","3350000"
,"II. SKUPAJ ODHODKI (40+41+42+43+45)","9317146405"
"40","TEKOČI ODHODKI","2600476179"
"400","Plače in drugi izdatki zaposlenim","916247730"
"4000","Plače in dodatki","809929313"
"4001","Regres za letni dopust","11410154"
"4002","Povračila in nadomestila","75391667"
"4003","Sredstva za delovno uspešnost","4451243"
"4004","Sredstva za nadurno delo","6109600"
"4005","Plače za delo nerezidentov po pogodbi","4390"
"4009","Drugi izdatki zaposlenim","8951363"
"401","Prispevki delodajalcev za socialno varnost","174780342"
"4010","Prispevek za pokojninsko in invalidsko zavarovanje","101597163"
"4011","Prispevek za zdravstveno zavarovanje","56372086"
"4012","Prispevek za zaposlovanje","614317"
"4013","Prispevek za starševsko varstvo","947328"
"4015","Premije kolektivnega dodatnega pokojninskega zavarovanja, na podlagi ZKDPZJU","15249448"
"402","Izdatki za blago in storitve","688065923"
"4020","Pisarniški in splošni material in storitve","76988182"
"4021","Posebni material in storitve","116181882"
"4022","Energija, voda, komunalne storitve in komunikacije","65823865"
"4023","Prevozni stroški in storitve","40575667"
"4024","Izdatki za službena potovanja","12768184"
"4025","Tekoče vzdrževanje","185204179"
"4026","Poslovne najemnine in zakupnine","61173911"
"4027","Kazni in odškodnine","15179332"
"4029","Drugi operativni odhodki","114170721"
"403","Plačila domačih obresti","673645277"
"4031","Plačila obresti od kreditov - poslovnim bankam","16720275"
"4032","Plačila obresti od kreditov - drugim finančnim institucijam","96444"
"4033","Plačila obresti od kreditov - drugim domačim kreditodajalcem","6941516"
"4034","Plačila obresti od vrednostnih papirjev izdanih na domačem trgu","649887042"
"404","Plačila tujih obresti","41047868"
"4040","Plačila obresti od kreditov - mednarodnim finančnim institucijam","1047868"
"4044","Plačila obresti od vrednostnih papirjev, izdanih na tujih trgih","40000000"
"409","Rezerve","106689039"
"4090","Splošna proračunska rezervacija","75000000"
"4091","Proračunska rezerva","18896559"
"4093","Sredstva za posebne namene","12792480"
"41","TEKOČI TRANSFERI","4990029882"
"410","Subvencije","409114641"
"4100","Subvencije javnim podjetjem","62870737"
"4102","Subvencije privatnim podjetjem in zasebnikom","346243904"
"411","Transferi posameznikom in gospodinjstvom","1279788628"
"4110","Transferi nezaposlenim","208781276"
"4111","Družinski prejemki in starševska nadomestila","535590530"
"4112","Transferi za zagotavljanje socialne varnosti","204042233"
"4113","Transferi vojnim invalidom, veteranom in žrtvam vojnega nasilja","55462700"
"4117","Štipendije","100020750"
"4119","Drugi transferi posameznikom","175891138"
"412","Transferi nepridobitnim organizacijam in ustanovam","107666904"
"4120","Tekoči transferi nepridobitnim organizacijam in ustanovam","107666904"
"413","Drugi tekoči domači transferi","3162419244"
"4130","Tekoči transferi občinam","19978679"
"4131","Tekoči transferi v sklade socialnega zavarovanja","1365881274"
"4132","Tekoči transferi v javne sklade","9970638"
"4133","Tekoči transferi v javne zavode","1630771122"
"4134","Tekoči transferi v državni proračun","721054"
"4135","Tekoča plačila drugim izvajalcem javnih služb, ki niso posredni proračunski uporabniki","95638994"
"4136","Tekoči transferi v javne agencije","39457483"
"414","Tekoči transferi v tujino","31040465"
"4140","Tekoči transferi mednarodnim institucijam","21325483"
"4141","Tekoči transferi tujim vladam in vladnim institucijam","33819"
"4142","Tekoči transferi neprofitnim organizacijam v tujini","1435186"
"4143","Drugi tekoči transferi v tujino","8245977"
"42","INVESTICIJSKI ODHODKI","685346665"
"420","Nakup in gradnja osnovnih sredstev","685346665"
"4200","Nakup zgradb in prostorov","8137413"
"4201","Nakup prevoznih sredstev","8719846"
"4202","Nakup opreme","57747360"
"4203","Nakup drugih osnovnih sredstev","71307"
"4204","Novogradnje, rekonstrukcije in adaptacije","439757655"
"4205","Investicijsko vzdrževanje in obnove","69481489"
"4206","Nakup zemljišč in naravnih bogastev","15227054"
"4207","Nakup nematerialnega premoženja","31831607"
"4208","Študije o izvedljivosti projektov, projektna dokumentacija, nadzor in investicijski inženiring","54372934"
"4209","Nakup blagovnih rezerv in intervencijskih zalog","0"
"43","INVESTICIJSKI TRANSFERI","609957910"
"431","Investicijski transferi pravnim in fizičnim osebam, ki niso proračunski uporabniki","140140821"
"4310","Investicijski transferi nepridobitnim organizacijam in ustanovam","32587452"
"4311","Investicijski transferi javnim podjetjem in družbam, ki so v lasti države ali občin","15331632"
"4313","Investicijski transferi privatnim podjetjem","52785710"
"4314","Investicijski transferi posameznikom in zasebnikom","39021571"
"4315","Investicijski transferi drugim izvajalcem javnih služb, ki niso posredni proračunski uporabniki","414457"
"432","Investicijski transferi proračunskim uporabnikom","469817089"
"4320","Investicijski transferi občinam","378033067"
"4321","Investicijski transferi javnim skladom in agencijam","967890"
"4322","Investicijski transferi v državni proračun","20000"
"4323","Investicijski transferi javnim zavodom","90796132"
"45","PLAČILA SREDSTEV V PRORAČUN EVROPSKE UNIJE","431335769"
"450","Plačila sredstev v proračun Evropske unije","431335769"
"4500","Plačila tradicionalnih lastnih sredstev v proračun Evropske unije","80725025"
"4501","Plačila sredstev v proračun EU iz naslova davka na dodano vrednost","56528889"
"4502","Plačila sredstev v proračun EU iz naslova bruto nacionalnega dohodka","271338667"
"4503","Plačila sredstev v proračun EU iz naslova popravka v korist Združenega Kraljestva","20200402"
"4504","Plačila sredstev v proračun EU iz naslova popravkov BND vira v korist Kraljevin Nizozemske in Švedske","2542786"
,"III. PRORAČUNSKI PRESEŽEK (PRORAČUNSKI PRIMANKLJAJ) (I.-II.) Skupaj prihodki minus skupaj odhodki","-907841690"
,"III/1. PRIMARNI PRESEŽEK (PRIMANKLJAJ) (I.-7102)-(II.-403-404) Skupaj prihodki brez prihodkov od obresti minus skupaj odhodki brez plačil obresti","-219648545"
,"IV. PREJETA VRAČILA DANIH POSOJIL IN PRODAJA KAPITALSKIH DELEŽEV (750+751+752)","4163931"
"75","PREJETA VRAČILA DANIH POSOJIL IN PRODAJA KAPITALSKIH DELEŽEV","4163931"
"750","Prejeta vračila danih posojil","3051931"
"7504","Prejeta vračila danih posojil od privatnih podjetij","2751931"
"7509","Prejeta vračila plačanih poroštev","300000"
"751","Prodaja kapitalskih deležev","12000"
"7513","Sredstva, pridobljena s prodajo drugih kapitalskih deležev","12000"
"752","Kupnine iz naslova privatizacije","1100000"
"7520","Sredstva kupnin iz naslova privatizacije","1100000"
,"V. DANA POSOJILA IN POVEČANJE KAPITALSKIH DELEŽEV (440+441+442)","133567265"
"44","DANA POSOJILA IN POVEČANJE KAPITALSKIH DELEŽEV","133567265"
"440","Dana posojila","54034765"
"4401","Dana posojila javnim skladom","600000"
"4402","Dana posojila javnim podjetjem in družbam, ki so v lasti države ali občin","0"
"4404","Dana posojila privatnim podjetjem","37758000"
"4409","Plačila zapadlih poroštev","15676765"
"441","Povečanje kapitalskih deležev in finančnih naložb","77266500"
"4410","Povečanje kapitalskih deležev v javnih podjetjih in družbam, ki so v lasti države ali občin","2000000"
"4414","Povečanje kapitalskih deležev v tujino","75266500"
"442","Poraba sredstev kupnin iz naslova privatizacije","2224000"
"4420","Dana posojila iz sredstev kupnin","760000"
"4421","Sredstva kupnin, razporejena v javne sklade in agencije","1464000"
"443","Povečanje namenskega premoženja v javnih skladih in drugih pravnih osebah javnega prava, ki imajo premoženje v svoji lasti","42000"
"4430","Povečanje  namenskega premoženja v javnih skladih","42000"
,"VI. PREJETA MINUS DANA POSOJILA IN SPREMEMBE KAPITALSKIH DELEŽEV (IV.-V.)","-129403334"
,"VII. ZADOLŽEVANJE (500+501)","3134228727"
"50","ZADOLŽEVANJE","3134228727"
,"VIII. ODPLAČILA DOLGA (550+551)","2096983703"
"55","ODPLAČILA DOLGA","2096983703"
"550","Odplačila domačega dolga","2091127357"
"5503","Odplačila kreditov drugim domačim kreditodajalcem","68354277"
"5504","Odplačila glavnice vrednostnih papirjev, izdanih na domačem trgu","2022773080"
"551","Odplačila dolga v tujino","5856346"
"5510","Odplačila dolga mednarodnim finančnim institucijam","5856346"
,"IX. SPREMEMBA STANJA SREDSTEV NA RAČUNU (I.+IV.+VII.-II.-V.-VIII.)","0"
,"X. NETO ZADOLŽEVANJE (VII.-VIII.)","1037245024"
,"XI. NETO FINANCIRANJE (VI.+X.-IX.)","907841690"
