"I.","SKUPAJ PRIHODKI (70+71+72+73+74+78)",8782665384
,"TEKOČI PRIHODKI (70+71)",7881748662
70,"DAVČNI PRIHODKI",7491316356
700,"Davki na dohodek in dobiček",2172818357
7000,"Dohodnina",1114781920
7001,"Davek od dohodkov pravnih oseb",1058036437
701,"Prispevki za socialno varnost",54958166
7010,"Prispevki zaposlenih",30819951
7011,"Prispevki delodajalcev",20506679
7012,"Prispevki samozaposlenih",2653011
7013,"Ostali prispevki za socialno varnost",978525
702,"Davki na plačilno listo in delovno silo",29181098
7021,"Posebni davek na določene prejemke",29181098
704,"Domači davki na blago in storitve",5113139755
7040,"Davek na dodano vrednost",3250948486
7041,"Drugi davki na blago in storitve",30351454
7042,"Trošarine (akcize)",1499249287
7044,"Davki na posebne storitve",132099096
7046,"Letna dajatev za uporabo vozil v cestnem prometu",106409952
7047,"Drugi davki na uporabo blaga in storitev",43520546
7048,"Davki od prometa motornih vozil",50560934
705,"Davki na mednarodno trgovino in transakcije",119394710
7050,"Carine",117817359
7051,"Druge uvozne dajatve",1577351
706,"Drugi davki",1824270
7060,"Drugi davki",1824270
71,"NEDAVČNI PRIHODKI",390432306
710,"Udeležba na dobičku in dohodki od premoženja",171991807
7100,"Prihodki od udeležbe na dobičku in dividend ter presežkov prihodkov nad odhodki",87633000
7102,"Prihodki od obresti",15000000
7103,"Prihodki od premoženja",69358807
711,"Takse in pristojbine",73099789
7110,"Sodne takse",36437830
7111,"Upravne takse in pristojbine",36661959
712,"Globe in druge denarne kazni",66157132
7120,"Globe in druge denarne kazni",66157132
713,"Prihodki od prodaje blaga in storitev",10129289
7130,"Prihodki od prodaje blaga in storitev",10129289
714,"Drugi nedavčni prihodki",69054289
7141,"Drugi nedavčni prihodki",69054289
72,"KAPITALSKI PRIHODKI",20521372
720,"Prihodki od prodaje osnovnih sredstev",19216019
7200,"Prihodki od prodaje zgradb in prostorov",17883240
7201,"Prihodki od prodaje prevoznih sredstev",1088636
7202,"Prihodki od prodaje opreme",213038
7203,"Prihodki od prodaje drugih osnovnih sredstev",31105
722,"Prihodki od prodaje zemljišč in neopredmetenih sredstev",1305353
7220,"Prihodki od prodaje kmetijskih zemljišč in gozdov",11200
7221,"Prihodki od prodaje stavbnih zemljišč",1294153
73,"PREJETE DONACIJE",6004434
730,"Prejete donacije iz domačih virov",171194
7300,"Prejete donacije in darila od domačih pravnih oseb",171194
731,"Prejete donacije iz tujine",5833240
7310,"Prejete donacije in darila od tujih nevladnih organizacij in fundacij",2284387
7311,"Prejete donacije in darila od tujih vlad in vladnih institucij",3504087
7312,"Prejete donacije in darila od tujih pravnih oseb",44766
74,"TRANSFERNI PRIHODKI",735368
740,"Transferni prihodki iz drugih javnofinančnih institucij",735368
7400,"Prejeta sredstva iz državnega proračuna",718424
7402,"Prejeta sredstva iz skladov socialnega zavarovanja",16944
78,"PREJETA SREDSTVA IZ EVROPSKE UNIJE",873655548
780,"Predpristopna sredstva Evropske unije",14732900
7800,"Prejeta sredstva PHARE",252900
7801,"Prejeta sredstva ISPA",14480000
781,"Prejeta sredstva iz proračuna EU za izvajanje skupne kmetijske politike",241621351
7810,"Prejeta sredstva iz proračuna EU iz naslova tržnih ukrepov v kmetijstvu iz Evropskega kmetijskega jamstvenega in usmerjevalnega sklada - Jamstveni del (EAGGF - Guarantee Fund) in Evropskega kmetijskega jamstvenega sklada (EKJS)",38634634
7811,"Prejeta sredstva iz proračuna EU iz naslova neposrednih plačil v kmetijstvu iz Evropskega kmetijskega jamstvenega in usmerjevalnega sklada - Jamstveni del (EAGGF - Guarantee Fund) in Evropskega kmetijskega jamstvenega sklada (EKJS)",66952300
7812,"Prejeta sredstva iz proračuna EU iz naslova programa razvoja podeželja iz Evropskega kmetijskega jamstvenega in usmerjevalnega sklada - Jamstveni del (EAGGF - Guarantee Fund) in Evropskega kmetijskega sklada za razvoj podeželja (EKSRP)",136034417
782,"Prejeta sredstva iz proračuna EU za strukturno politiko",460204459
7821,"Prejeta sredstva iz proračuna EU iz Evropskega sklada za regionalni razvoj (ERDF)",278107493
7822,"Prejeta sredstva iz Evropskega socialnega sklada (ESF)",182096966
783,"Prejeta sredstva iz proračuna EU za kohezijsko politiko",108684559
7830,"Prejeta sredstva iz Kohezijskega sklada (CF)",108684559
784,"Prejeta sredstva iz proračuna EU za izvajanje notranje politike",23395325
7841,"Druga prejeta sredstva iz proračuna EU za izvajanje notranje politike",23395325
786,"Ostala prejeta sredstva iz proračuna Evropske unije",5571383
7860,"Ostala prejeta sredstva iz proračuna EU",5571383
788,"Prejeta vračila sredstev iz proračuna Evropske unije",19445571
7880,"Prejeta vračila sredstev iz proračuna Evropske unije",19445571
"II.","SKUPAJ ODHODKI (40+41+42+43+45)",9916340994
40,"TEKOČI ODHODKI",2551381558
400,"Plače in drugi izdatki zaposlenim",1038580222
4000,"Plače in dodatki",882237347
4001,"Regres za letni dopust",27802321
4002,"Povračila in nadomestila",96751004
4003,"Sredstva za delovno uspešnost",14011819
4004,"Sredstva za nadurno delo",10636107
4005,"Plače za delo nerezidentov po pogodbi",13256
4009,"Drugi izdatki zaposlenim",7128367
401,"Prispevki delodajalcev za socialno varnost",182610163
4010,"Prispevek za pokojninsko in invalidsko zavarovanje",105099173
4011,"Prispevek za zdravstveno zavarovanje",60454936
4012,"Prispevek za zaposlovanje",528545
4013,"Prispevek za starševsko varstvo",871535
4015,"Premije kolektivnega dodatnega pokojninskega zavarovanja, na podlagi ZKDPZJU",15655973
402,"Izdatki za blago in storitve",933566977
4020,"Pisarniški in splošni material in storitve",131823716
4021,"Posebni material in storitve",266287088
4022,"Energija, voda, komunalne storitve in komunikacije",64955928
4023,"Prevozni stroški in storitve",45559118
4024,"Izdatki za službena potovanja",25977730
4025,"Tekoče vzdrževanje",191466688
4026,"Poslovne najemnine in zakupnine",65467229
4027,"Kazni in odškodnine",9364164
4029,"Drugi operativni odhodki",132665316
403,"Plačila domačih obresti",241433817
4031,"Plačila obresti od kreditov - poslovnim bankam",6921752
4032,"Plačila obresti od kreditov - drugim finančnim institucijam",860000
4033,"Plačila obresti od kreditov - drugim domačim kreditodajalcem",12000000
4034,"Plačila obresti od vrednostnih papirjev izdanih na domačem trgu",221652065
404,"Plačila tujih obresti",117849107
4040,"Plačila obresti od kreditov - mednarodnim finančnim institucijam",3907594
4042,"Plačila obresti od kreditov - tujim poslovnim bankam in finančnim institucijam",254013
4044,"Plačila obresti od vrednostnih papirjev, izdanih na tujih trgih",113687500
409,"Rezerve",37341272
4090,"Splošna proračunska rezervacija",28346064
4091,"Proračunska rezerva",5655208
4093,"Sredstva za posebne namene",3340000
41,"TEKOČI TRANSFERI",5579503486
410,"Subvencije",844784410
4100,"Subvencije javnim podjetjem",71327053
4101,"Subvencije finančnim institucijam",4277249
4102,"Subvencije privatnim podjetjem in zasebnikom",769180108
411,"Transferi posameznikom in gospodinjstvom",1248401870
4110,"Transferi nezaposlenim",139737563
4111,"Družinski prejemki in starševska nadomestila",585615033
4112,"Transferi za zagotavljanje socialne varnosti",155560501
4113,"Transferi vojnim invalidom, veteranom in žrtvam vojnega nasilja",80291469
4117,"Štipendije",119287870
4119,"Drugi transferi posameznikom",167909434
412,"Transferi neprofitnim organizacijam in ustanovam",83522449
4120,"Tekoči transferi neprofitnim organizacijam in ustanovam",83522449
413,"Drugi tekoči domači transferi",3376697201
4130,"Tekoči transferi občinam",66972554
4131,"Tekoči transferi v sklade socialnega zavarovanja",1303331324
4132,"Tekoči transferi v javne sklade",12696770
4133,"Tekoči transferi v javne zavode",1898731580
4134,"Tekoči transferi v državni proračun",639217
4135,"Tekoča plačila drugim izvajalcem javnih služb, ki niso posredni proračunski uporabniki",76626678
4136,"Tekoči transferi v javne agencije",17699078
414,"Tekoči transferi v tujino",26097556
4140,"Tekoči transferi mednarodnim institucijam",15608025
4141,"Tekoči transferi tujim vladam in vladnim institucijam",33737
4142,"Tekoči transferi neprofitnim organizacijam v tujini",1523308
4143,"Drugi tekoči transferi v tujino",8932486
42,"INVESTICIJSKI ODHODKI",603300730
420,"Nakup in gradnja osnovnih sredstev",603300730
4200,"Nakup zgradb in prostorov",20673354
4201,"Nakup prevoznih sredstev",8568188
4202,"Nakup opreme",73623228
4203,"Nakup drugih osnovnih sredstev",360804
4204,"Novogradnje, rekonstrukcije in adaptacije",249320722
4205,"Investicijsko vzdrževanje in obnove",87271506
4206,"Nakup zemljišč in naravnih bogastev",25513049
4207,"Nakup nematerialnega premoženja",35518590
4208,"Študije o izvedljivosti projektov, projektna dokumentacija, nadzor in investicijski inženiring",102451289
43,"INVESTICIJSKI TRANSFERI",730109648
431,"Investicijski transferi pravnim in fizičnim osebam, ki niso proračunski uporabniki",290583286
4310,"Investicijski transferi neprofitnim organizacijam in ustanovam",18309562
4311,"Investicijski transferi javnim podjetjem in družbam, ki so v lasti države ali občin",51232691
4313,"Investicijski transferi privatnim podjetjem",178461204
4314,"Investicijski transferi posameznikom in zasebnikom",37877002
4315,"Investicijski transferi drugim izvajalcem javnih služb, ki niso posredni proračunski uporabniki",4677827
4316,"Investicijski transferi v tujino",25000
432,"Investicijski transferi proračunskim uporabnikom",439526362
4320,"Investicijski transferi občinam",319029909
4321,"Investicijski transferi javnim skladom in agencijam",6269890
4323,"Investicijski transferi javnim zavodom",114226563
45,"PLAČILA SREDSTEV V PRORAČUN EVROPSKE UNIJE",452045572
450,"Plačila sredstev v proračun Evropske unije",452045572
4500,"Plačila tradicionalnih lastnih sredstev v proračun Evropske unije",98125200
4501,"Plačila sredstev v proračun EU iz naslova davka na dodano vrednost",62118540
4502,"Plačila sredstev v proračun EU iz naslova bruto nacionalnega dohodka",254428035
4503,"Plačila sredstev v proračun EU iz naslova popravka v korist Združenega Kraljestva",30233797
4504,"Plačila sredstev v proračun EU iz naslova popravkov BND vira v korist Kraljevin Nizozemske in Švedske",7140000
"III.","PRORAČUNSKI PRESEŽEK (PRORAČUNSKI PRIMANJKLJAJ) (I. - II.)",-1133675610
"III/1.","PRIMARNI PRESEŽEK   (PRIMANJKLJAJ) (I. - 7102) - ( II. - 403 – 404)",-789392686
"IV.","PREJETA VRAČILA DANIH POSOJIL IN PRODAJA KAPITALSKIH DELEŽEV (750+751+752)",21068487
75,"PREJETA VRAČILA DANIH POSOJIL IN PRODAJA KAPITALSKIH DELEŽEV",21068487
750,"Prejeta vračila danih posojil",19875600
7500,"Prejeta vračila danih posojil od posameznikov in zasebnikov",33600
7501,"Prejeta vračila danih posojil - od javnih skladov",16260000
7504,"Prejeta vračila danih posojil od privatnih podjetij",3582000
752,"Kupnine iz naslova privatizacije",1192887
7520,"Sredstva kupnin iz naslova privatizacije",1192887
"V.","DANA POSOJILA IN POVEČANJE KAPITALSKIH DELEŽEV (440+441+442)",329759750
44,"DANA POSOJILA IN POVEČANJE KAPITALSKIH DELEŽEV",329759750
440,"Dana posojila",71363911
4404,"Dana posojila privatnim podjetjem",57762401
4409,"Plačila zapadlih poroštev",13601510
441,"Povečanje kapitalskih deležev in finančnih naložb",249820607
4410,"Povečanje kapitalskih deležev v javnih podjetjih in družbam, ki so v lasti države ali občin",80000000
4411,"Povečanje kapitalskih deležev v finančnih institucijah",160000000
4414,"Povečanje kapitalskih deležev v tujino",9820607
442,"Poraba sredstev kupnin iz naslova privatizacije",1182504
4420,"Dana posojila iz sredstev kupnin",162744
4421,"Sredstva kupnin, razporejena v javne sklade in agencije",944647
4422,"Povečanje kapitalskih deležev države iz sredstev kupnin",75113
443,"Povečanje namenskega premoženja v javnih skladih in drugih pravnih osebah javnega prava, ki imajo premoženje v svoji lasti",7392728
4430,"Povečanje  namenskega premoženja v javnih skladih",7392728
"VI.","PREJETA MINUS DANA POSOJILA IN SPREMEMBE KAPITALSKIH DELEŽEV (IV. - V.)",-308691263
"VII.","ZADOLŽEVANJE (500+501)",2296167073
50,"ZADOLŽEVANJE",2296167073
500,"Domače zadolževanje",-0
5000,"Najeti krediti pri Banki Slovenije",-0
"VIII.","ODPLAČILA DOLGA (550+551)",853800200
55,"ODPLAČILA DOLGA",853800200
550,"Odplačila domačega dolga",428151240
5501,"Odplačila kreditov poslovnim bankam",65097647
5503,"Odplačila kreditov drugim domačim kreditodajalcem",55000000
5504,"Odplačila glavnice vrednostnih papirjev, izdanih na domačem trgu",308053593
551,"Odplačila dolga v tujino",425648960
5510,"Odplačila dolga mednarodnim finančnim institucijam",18900000
5512,"Odplačila dolga tujim poslovnim bankam in finančnim institucijam",6748960
5514,"Odplačila glavnice vrednostnih papirjev, izdanih na tujih trgih",400000000
"IX.","SPREMEMBA STANJA SREDSTEV NA RAČUNU   (I.+IV.+VII.-II.-V.-VIII.)",0
"X.","NETO  ZADOLŽEVANJE (VII.-VIII.)",1442366873
"XI.","NETO  FINANCIRANJE (VI.+X.-IX.)",1133675610
